{
    "caseId": 111113,
    "caseDescription": "Single fiber verification case, using strain tensors. Fewer load cases for faster debugging. Example of orthotropic material input",
    "units": {
        "length": "micrometer",
        "mass": "gram",
        "time": "second"
    },
    "boundaryConditions": {
        "kind": "Okereke"
    },
    "loading": {
        "kind": "tensor",
        "labels": ["x normal", "zx shear"],
        "magnitudeMultiplier": 0.001,
        "tensors": [
            [
                [1, 0, 0],
                [0, null, 0],
                [0, 0, null]
            ],
            [
                [0, 0, 0],
                [0, 0, 0],
                [1, 0, 0]
            ]
        ],
        "expectedProperties": [["E11", "v12", "v13"], ["G31"]]
    },
    "materials": [
        {
            "materialIndex": 1,
            "materialName": "Polypropylene",
            "materialType": "isotropic",
            "elasticModuli": [1.31e6],
            "poissonsRatios": [0.43],
            "density": 903e-15
        },
        {
            "materialIndex": 2,
            "materialName": "Glass fiber",
            "materialType": "orthotropic",
            "elasticModuli": [7.3e7, 7.3e6, 7.3e6],
            "shearModuli": [3.8e7, 3.8e6, 3.8e6],
            "poissonsRatios": [0.2, 0.3, 0.3],
            "density": 1450e-15
        }
    ],
    "mesh": {
        "elementType": "SOLID186",
        "nodeFileRelativePath": "./meshes/fiber_corners_ex01.node",
        "elementFileRelativePath": "./meshes/fiber_corners_ex01.elem"
    },
    "runnerOptions": {
        "nproc": 2,
        "jobname": "single_fiber_ex02",
        "run_location": "./ex02_working_dir"
    }
}
